{"attempt": 1, "base_sha": "0000000000000000000000000000000000000000", "coverage_regression": false, "criteria": [{"evidence_ref": "evidence/9.0/report.md#criteria", "id": "RF-18"}], "evidence": ["evidence/9.0/report.md"], "final_state_sha256": "0000000000000000000000000000000000000000000000000000000000000000", "patch_ref": "evidence/9.0/patch.diff", "patch_sha256": "0000000000000000000000000000000000000000000000000000000000000000", "review_verdict": "APPROVED", "run_id": "run", "schema_version": 2, "status": "done", "task_id": "9.0", "tests": [{"command": "go test ./...", "exit_code": 0, "output_sha256": "0000000000000000000000000000000000000000000000000000000000000000"}]}